url,Author,Title,Date,date_clean
https://www.texastribune.org/2018/10/26/hays-county-expands-early-voting-access-texas-state-university-student/,ALEXA URA,Hays County expands early voting access for Texas State University students,"OCT. 26, 2018",2018-10-26
https://www.texastribune.org/2018/10/30/texas-representatives-congress-trump-proposal-end-birthright-citizens/,ANDREW EVERSDEN,Texas Democrats in Congress oppose Trump proposal to end birthright citizenship. Most Republicans have stayed silent.,"OCT. 30, 2018",2018-10-30
https://www.texastribune.org/2018/10/25/trump-administration-send-hundreds-troops-us-mexico-border-reports-say/,EMMA PLATOFF,"Trump administration to send hundreds of troops to the U.S-Mexico border, reports say","OCT. 25, 2018",2018-10-25
https://www.texastribune.org/2018/10/25/waller-county-expands-early-voting-prairie-view-m-students/,MATT ZDUN,Waller County expands early voting for Prairie View A&M students,"OCT. 25, 2018",2018-10-25
https://www.texastribune.org/2018/10/30/texas-state-capitol-offices-evacuated-due-suspicious-package/,MATT ZDUN,"Authorities find ""no viable threat"" after evacuation at the Texas Capitol due to a suspicious package","OCT. 30, 2018",2018-10-30
https://www.texastribune.org/2018/11/01/harris-county-texas-juvenile-judges-private-attorneys/,NEENA SATIJA,Harris County juvenile judges and private attorneys accused of cronyism: “Everybody wins but the kids”,"NOV. 1, 2018",2018-11-01
https://www.texastribune.org/2018/10/29/department-defense-says-its-sending-5200-troops-us-mexico-border/,JULIÁN AGUILAR,"Department of Defense says it's sending 5,200 troops to U.S.-Mexico border","OCT. 29, 2018",2018-10-29
https://www.texastribune.org/2018/11/01/texas-gov-greg-abbott-has-pitched-plan-fix-school-finance/,ALIYYA SWABY,"Behind closed doors, Greg Abbott’s office has pitched a plan to fix Texas school finance","NOV. 1, 2018",2018-11-01
https://www.texastribune.org/2018/10/30/trump-executive-order-end-citizenship-children-born-us-noncitizens/,THE WASHINGTON POST,Trump eyeing executive order to end citizenship for children born in U.S. to noncitizens,"OCT. 30, 2018",2018-10-30
https://www.texastribune.org/2018/10/30/texas-border-lawmakers-troop-deployment/,JULIÁN AGUILAR,Texas' border lawmakers say they're in the dark on troop deployment,"OCT. 30, 2018",2018-10-30
https://www.texastribune.org/2018/10/24/family-separation-federal-agencies-dhs-hhs-unprepared/,TEO ARMUS,"Federal agencies were unprepared to deal with family separations, government report says","OCT. 24, 2018",2018-10-24
https://www.texastribune.org/2018/10/25/cuellar-aide-fired-pregnancy/,THE WASHINGTON POST,Former aide to Texas congressman files complaint saying she was fired over pregnancy,"OCT. 25, 2018",2018-10-25
https://www.texastribune.org/2018/10/25/donald-trump-considering-plan-ban-entry-migrants-southern-border/,THE WASHINGTON POST,"Trump considering plan to ban entry of migrants at southern border, deny asylum","OCT. 25, 2018",2018-10-25
https://www.texastribune.org/2018/10/24/ted-cruz-vs-beto-orourke-reddit-discussion-ama-texas-reporters/,BOBBY BLANCHARD,Five Texas reporters answer questions about the Ted Cruz-Beto O'Rourke race,"OCT. 24, 2018",2018-10-24
https://www.texastribune.org/2018/10/24/family-separation-deterrent-apprehensions-immigration/,TEO ARMUS,"As border crossings surge, some migrants say they came now because family separation is over","OCT. 24, 2018",2018-10-24
https://www.texastribune.org/2018/10/28/austin-water-boil-notice-lifted-after-seven-days/,CARLOS ANCHONDO,Austin lifts city-wide boil water notice,"OCT. 28, 2018",2018-10-28
https://www.texastribune.org/2018/10/31/ted-cruz-beto-orourke-poll-uttyler-texas/,MATT ZDUN,"Ted Cruz’s lead over Beto O’Rourke narrows to 3.6, UT-Tyler poll says","OCT. 31, 2018",2018-10-31
https://www.texastribune.org/2018/10/29/lawyers-charles-schwertner-say-they-have-proof-his-phone-didnt-send-ex/,SHANNON NAJMABADI,Lawyers for state Sen. Charles Schwertner say forensic review proves explicit texts didn't come from his phone,"OCT. 29, 2018",2018-10-29
https://www.texastribune.org/2018/10/24/texas-values-collide-fight-over-houston-dallas-bullet-train/,BRANDON FORMBY,Texas values collide in fight over Houston-Dallas high speed rail,"OCT. 24, 2018",2018-10-24
https://www.texastribune.org/2018/10/31/how-fix-affordable-housing-texas-texans/,ALEX SAMUELS,"How to fix affordable housing in Texas, by Texans","OCT. 31, 2018",2018-10-31
https://www.texastribune.org/2018/10/26/army-corps-texas-officials-propose-hurricane-protection-plan-houston/,KIAH COLLIER,"Army Corps, Texas officials propose sweeping hurricane protection plan","OCT. 26, 2018",2018-10-26
https://www.texastribune.org/2018/10/25/texas-doctors-seek-more-opioid-addiction-treatment-options-under-medic/,MARISSA EVANS,Texas doctors seek more opioid addiction treatment options under Medicaid,"OCT. 25, 2018",2018-10-25
https://www.texastribune.org/2018/10/31/texas-subsidized-child-care/,ALLYSON WALLER,Over a million Texas children could qualify for subsidized child care — but less than 10 percent of them receive it,"OCT. 31, 2018",2018-10-31
https://www.texastribune.org/2018/11/01/14th-amendment-undocumented-immigrants-citizenship-texas/,HANNAH WILEY,Undocumented immigrants say a better life – not children's citizenship – the main reason they come to Texas,"NOV. 1, 2018",2018-11-01
https://www.texastribune.org/2018/10/31/ut-tt-poll-texans-say-immigration-border-security-top-issues/,ROSS RAMSEY,"Texans’ top issues facing the state? Immigration and border security, according to the UT/TT poll","OCT. 31, 2018",2018-10-31
https://www.texastribune.org/2018/10/26/migrant-mother-denied-surgery-scar-ice-detention/,HANNAH WILEY,"After ICE detained this migrant in Texas, her C-section scar ripped open and she was denied surgery for 4 months","OCT. 26, 2018",2018-10-26
https://www.texastribune.org/2018/10/25/uh-and-unt-hsc-given-go-ahead-open-medical-schools/,SHANNON NAJMABADI,Texas higher education board approves medical schools for University of Houston and UNT Health Science Center,"OCT. 25, 2018",2018-10-25
https://www.texastribune.org/2018/10/31/prominent-attorney-tony-buzbee-says-hes-running-houston-mayor/,SHANNON NAJMABADI,"Boisterous attorney, political donor Tony Buzbee says he’s running for Houston mayor in 2019","OCT. 31, 2018",2018-10-31
https://www.texastribune.org/2018/10/30/honduran-migrant-caravan-border-trump-threats/,JAY ROOT,Honduran migrants following the caravan continue on despite Donald Trump’s threats,"OCT. 30, 2018",2018-10-30
https://www.tribtalk.org/2018/10/08/yall-we-need-a-divorce/,Steve Fischer,"Y’all, we need a divorce.","By Steve Fischer,  Oct. 8, 2018",2018-10-08
https://www.tribtalk.org/2018/10/29/let-texas-be-texas-unity-through-federalism/,Chip Roy,Let Texas be Texas: Unity through Federalism,"By Chip Roy,  Oct. 29, 2018",2018-10-29
