url,Author,Title,Date,date_clean
https://www.texastribune.org/2018/09/15/donald-trump-endorses-dallas-congressman-pete-sessions-re-election/,PATRICK SVITEK,Trump endorses Dallas congressman Pete Sessions for re-election,"SEPT. 15, 2018",2018-09-15
https://www.texastribune.org/2018/09/13/texas-senate-republican-supermajority/,ALEX SAMUELS,"With a supermajority, Republicans have complete control of the Texas Senate. That's at risk this election cycle.","SEPT. 13, 2018",2018-09-13
https://www.texastribune.org/2018/09/12/statewide-judicial-elections-federal-judge-upholds-partisan/,ALEXA URA,Federal judge upholds Texas' partisan statewide judicial elections system,"SEPT. 12, 2018",2018-09-12
https://www.texastribune.org/2018/09/11/democrat-henry-cuellar-fundraising-republican-john-carter/,ABBY LIVINGSTON,"In the U.S. House, Democrat Henry Cuellar raises eyebrows by fundraising for Republican John Carter","SEPT. 11, 2018",2018-09-11
https://www.texastribune.org/2018/09/08/trump-official-ted-cruz-lose-beto-o-rourke/,JOLIE MCCULLOUGH,Report: Trump official says U.S. Sen. Ted Cruz could lose to U.S. Rep. Beto O'Rourke,"SEPT. 8, 2018",2018-09-08
https://www.texastribune.org/2018/09/14/ted-cruz-beto-orourke-agree-3-debates/,PATRICK SVITEK,"Cruz, O'Rourke agree to 3 debates","SEPT. 14, 2018",2018-09-14
https://www.texastribune.org/2018/08/31/john-carter-mj-hegar-2018/,ABBY LIVINGSTON,U.S. Rep. John Carter prepares for tougher-than-usual race against MJ Hegar,"AUG. 31, 2018",2018-08-31
https://www.texastribune.org/2018/09/08/ted-cruz-beto-orourke-kick-jumpstart-post-labor-day-campaigns-harris-c/,PATRICK SVITEK,"Cruz, O'Rourke rev up post-Labor Day campaigns in battleground Harris County","SEPT. 8, 2018",2018-09-08
https://www.texastribune.org/2018/09/07/will-hurd-gina-ortiz-jones/,ALANA ROCHA,"Meet U.S. Rep. Will Hurd and his Democratic challenger, Gina Ortiz Jones","SEPT. 7, 2018",2018-09-07
https://www.texastribune.org/2018/09/06/democrats-dallas-2018-battleground-texas-house/,CASSANDRA POLLOCK,Democrats are turning Dallas into a midterm battleground for the Texas House,"SEPT. 6, 2018",2018-09-06
https://www.texastribune.org/2018/09/06/orourke-texts-immigrants/,PATRICK SVITEK,"O'Rourke campaign: ""Impostor"" responsible for texts about helping undocumented immigrants vote","SEPT. 6, 2018",2018-09-06
https://www.texastribune.org/2018/09/07/ted-cruz-slams-beto-orourke-PAC-fundraiser/,ABBY LIVINGSTON,Ted Cruz campaign criticizes Beto O'Rourke for co-hosting fundraiser with PAC,"SEPT. 7, 2018",2018-09-07
https://www.texastribune.org/2018/09/12/border-patrol-apprehensions-families-increased-38-percent-august/,JULIÁN AGUILAR,Border Patrol apprehensions of families increased 38 percent in August,"SEPT. 12, 2018",2018-09-12
https://www.texastribune.org/2018/09/13/mj-hegar-fires-back-henry-cuellar-helping-her-gop-opponent-fundraise/,ABBY LIVINGSTON,MJ Hegar fires back at fellow Democrat Henry Cuellar for helping her GOP opponent fundraise,"SEPT. 13, 2018",2018-09-13
https://www.texastribune.org/2018/09/14/jerry-patterson-Miguel-Suazo-george-p-bush-texas-elections-2018/,BOBBY BLANCHARD,"Jerry Patterson, a Republican, endorses Democrat Miguel Suazo over George P. Bush","SEPT. 14, 2018",2018-09-14
https://www.texastribune.org/2018/09/12/rudy-giuliani-headline-pete-sessions-fundraiser/,ABBY LIVINGSTON,Rudy Giuliani to headline Pete Sessions fundraiser,"SEPT. 12, 2018",2018-09-12
https://www.texastribune.org/2018/09/11/greg-abbott-campaign-ad-pre-kindergarten-funding/,TEO ARMUS,Gov. Greg Abbott's campaign ads boast about expanding pre-K. Advocates say his claims are misleading.,"SEPT. 11, 2018",2018-09-11
https://www.texastribune.org/2018/08/31/ted-cruz-beto-orourke-donald-trump-texas/,ALEX SAMUELS,"Donald Trump says he'll campaign for Ted Cruz at ""biggest stadium in Texas we can find""","AUG. 31, 2018",2018-08-31
https://www.texastribune.org/2018/09/04/cruz-orourke-el-paso-eminent-domain/,PATRICK SVITEK,"Cruz allies take aim at O'Rourke over eminent domain, father-in-law","SEPT. 4, 2018",2018-09-04
https://www.texastribune.org/2018/09/09/beto-orourke-town-hall-san-marcos-texas-state/,TEO ARMUS,"At a Texas State town hall, college enthusiasm for O'Rourke was on display","SEPT. 9, 2018",2018-09-09
https://www.texastribune.org/2018/09/05/obamacare-texas-block-california-fort-worth-affordable-care-act/,EMMA PLATOFF,Texas asks a federal judge to block Obamacare nationwide,"SEPT. 5, 2018",2018-09-05
https://www.texastribune.org/2018/08/31/beto-orourke-dwi-episode-1998-included-car-crash-and-alleged-attempt-f/,THE WASHINGTON POST,Beto O’Rourke DWI episode in 1998 included car crash and alleged attempt to flee,"AUG. 31, 2018",2018-08-31
https://www.texastribune.org/2018/09/12/analysis-ted-cruz-beto-orourke-swoon-trouble/,ROSS RAMSEY,Analysis: The swoon for Beto O’Rourke doesn’t mean Ted Cruz will lose,"SEPT. 12, 2018",2018-09-12
https://www.texastribune.org/2018/09/12/texas-migrant-families-separated-zero-tolerance/,HANNAH WILEY,More than 400 kids remain separated from their parents. Here’s one lawyer's long-shot plan to reunite a family,"SEPT. 12, 2018",2018-09-12
https://www.texastribune.org/2018/09/11/federal-government-greatly-expand-tornillo-shelter-unaccompanied-minor/,JULIÁN AGUILAR,Federal government to greatly expand Tornillo shelter for unaccompanied minors,"SEPT. 11, 2018",2018-09-11
https://www.texastribune.org/2018/09/05/tribcast-trump-vows-stump-cruz-texas/,EMILY RAMSHAW,TribCast: Trump vows to stump for Cruz in Texas,"SEPT. 5, 2018",2018-09-05
https://www.texastribune.org/2018/09/07/state-rep-ron-reynolds-turns-himself-begin-serving-year-long-jail-sent/,JOLIE MCCULLOUGH,State Rep. Ron Reynolds turns himself in to serve year-long jail sentence,"SEPT. 7, 2018",2018-09-07
https://www.texastribune.org/2018/09/05/fetal-remains-texas-ruling-abortion-rights/,MARISSA EVANS,Judge strikes down Texas law requiring burial or cremation of fetal remains,"SEPT. 5, 2018",2018-09-05
https://www.texastribune.org/2018/09/05/john-cornyn-defends-supreme-court-nominee-brett-kavanaughs-impartialit/,ANDREW EVERSDEN,U.S. Sen. John Cornyn defends Supreme Court nominee Brett Kavanaugh's impartiality at hearing,"SEPT. 5, 2018",2018-09-05
https://www.texastribune.org/2018/09/14/hurricane-florence-bears-down-east-coast-texas-faces-its-own-floods/,OMAR RODRIGUEZ-ORTIZ,"As Hurricane Florence bears down on East Coast, Texas faces flooding from Gulf Coast disturbance","SEPT. 14, 2018",2018-09-14
https://www.texastribune.org/2018/09/06/trump-administration-circumvent-court-limits-detention-child-migrants/,THE WASHINGTON POST,Trump administration to circumvent court limits on detention of child migrants,"SEPT. 6, 2018",2018-09-06
https://www.texastribune.org/2018/09/06/livestream-king-raymond/,OMAR RODRIGUEZ-ORTIZ,"Texas Reps. Tracy King and Richard Peña Raymond talk health care, school finance, border security and the next legislative session","SEPT. 6, 2018",2018-09-06
https://www.texastribune.org/2018/09/05/analysis-candidates-cussing-beto-orourke-ted-cruz-national-anthem/,ROSS RAMSEY,Analysis: Some voters want candidates who watch what they say. Some don’t.,"SEPT. 5, 2018",2018-09-05
https://www.texastribune.org/2018/09/11/alamo-texas-education-board/,KATHRYN LUNDSTROM,"Texas education board workgroup changes course on ""heroic"" Alamo defenders","SEPT. 11, 2018",2018-09-11
https://www.texastribune.org/2018/08/31/texas-education-agency-children-migrant-shelters/,TEO ARMUS,Texas says it won't fund education for children in shelters,"AUG. 31, 2018",2018-08-31
https://www.texastribune.org/2018/09/10/ut-texas-m-smu-rise-rice-and-baylor-slip-us-news-rankings/,SHANNON NAJMABADI,"UT-Austin, A&M, SMU and UH rise; Rice and Baylor slip in U.S. News rankings","SEPT. 10, 2018",2018-09-10
https://www.texastribune.org/2018/09/05/property-tax-relief-available-texas-homeowners-homestead-exemptions/,ALEX SAMUELS,"Lawmakers couldn't agree on property tax reform, but Texas homeowners can still get some relief","SEPT. 5, 2018",2018-09-05
https://www.texastribune.org/2018/09/06/after-ice-raid-north-texas-immigrants-face-uncertain-futures/,JULIÁN AGUILAR,"After ICE raid in North Texas, immigrants face uncertain futures","SEPT. 6, 2018",2018-09-06
https://www.texastribune.org/2018/09/06/john-cornyn-floats-ousting-cory-booker-senate-during-kavanaugh-hearing/,ABBY LIVINGSTON,John Cornyn floats ousting Cory Booker from Senate during Kavanaugh hearing,"SEPT. 6, 2018",2018-09-06
https://www.texastribune.org/2018/09/11/report-texas-rules-lax-cleanup-polluted-sites/,KIAH COLLIER,Report: Texas criteria for polluted site cleanup 'significantly weaker' than neighboring states,"SEPT. 11, 2018",2018-09-11
https://www.texastribune.org/2018/08/31/texas-education-agency-special-education-director/,ALIYYA SWABY,Texas Education Agency chooses familiar face to lead special education overhaul,"AUG. 31, 2018",2018-08-31
https://www.texastribune.org/2018/09/13/dallas-officer-amber-guyger-botham-jean-fatal-shooting/,THE WASHINGTON POST,"Why the Dallas officer who killed her neighbor might have trouble with a ""deadly force"" defense","SEPT. 13, 2018",2018-09-13
https://www.texastribune.org/2018/09/06/four-price-texas-house-speaker-candidate/,ALEX SAMUELS,State Rep. Four Price files to run for Texas House speaker,"SEPT. 6, 2018",2018-09-06
https://www.texastribune.org/2018/09/14/willie-nelson-beto-orourke-political-concert/,THE WASHINGTON POST,Willie Nelson is playing a political concert for Beto O’Rourke. Some fans are abandoning him.,"SEPT. 14, 2018",2018-09-14
https://www.texastribune.org/2018/09/13/texas-poverty-census-2017-lowest-levels-decade/,ALEXA URA,Poverty in Texas drops to lowest levels in more than a decade,"SEPT. 13, 2018",2018-09-13
https://www.texastribune.org/2018/09/04/supreme-court-brett-kavanaugh-texas-confirmation/,EMMA PLATOFF,Why Supreme Court Justice Brett Kavanaugh would be good news for Texas Republicans,"SEPT. 4, 2018",2018-09-04
https://www.texastribune.org/2018/09/05/state-audit-finds-serious-flaws-texas-education-agency-contracting-pro/,ALIYYA SWABY,State audit finds serious flaws in Texas Education Agency contracting process,"SEPT. 5, 2018",2018-09-05
https://www.texastribune.org/2018/09/06/texas-charter-schools-funding-education-migrant-shelters/,ALIYYA SWABY,Texas won't pay to educate migrant kids in shelters. Now two charter schools are scrambling.,"SEPT. 6, 2018",2018-09-06
https://www.texastribune.org/2018/09/14/border-patrol-working-stop-truck-drivers-smuggling-migrants/,HANNAH WILEY,The Border Patrol is trying to stop truck drivers from smuggling migrants. But cases have increased.,"SEPT. 14, 2018",2018-09-14
https://www.texastribune.org/2018/09/08/trumps-border-wall-threatens-end-texas-families-250-years-ranching-rio/,THE WASHINGTON POST,Trump’s border wall threatens to end Texas families’ 250 years of ranching on Rio Grande,"SEPT. 8, 2018",2018-09-08
https://www.texastribune.org/2018/09/10/robert-duncan-resigned-tensions-simmered-texas-tech-regents/,SHANNON NAJMABADI,"Before Robert Duncan resigned, tensions simmered with Texas Tech regents for months","SEPT. 10, 2018",2018-09-10
https://www.texastribune.org/2018/09/12/alamo-heroic-texas-education-board/,KATHRYN LUNDSTROM,"State Board of Education votes to keep ""heroic"" in description of Alamo defenders","SEPT. 12, 2018",2018-09-12
https://www.texastribune.org/2018/09/05/Dallas-County-Bail-Machine/,"BY MUSTAFA Z. MIRZA, THE MARSHALL PROJECT","In Dallas County, bail is set in secret — and often in seconds","SEPT. 5, 2018",2018-09-05
https://www.texastribune.org/2018/09/07/greg-abbott-texas-board-education-alamo-curriculum/,TEO ARMUS,Gov. Greg Abbott warns Texas education board of “political correctness” over Alamo history standards,"SEPT. 7, 2018",2018-09-07
https://www.texastribune.org/2018/09/13/texas-land-commissioner-george-p-bush-signs-plan-overhaul-alamo-plaza/,CASSANDRA POLLOCK,Texas Land Commissioner George P. Bush signs plan to overhaul Alamo Plaza,"SEPT. 13, 2018",2018-09-13
https://www.texastribune.org/2018/09/15/texas-border-patrol-agent-accused-serial-killing-spree-laredo/,MARISSA EVANS,"Texas Border Patrol agent accused of ""serial killing spree"" in Laredo","SEPT. 15, 2018",2018-09-15
https://www.texastribune.org/2018/09/11/texas-tea-considering-cutting-high-school-cosmetology-courses/,KATHRYN LUNDSTROM,Texas considering cutting high school cosmetology courses,"SEPT. 11, 2018",2018-09-11
https://www.texastribune.org/2018/09/18/republican-pete-flores-track-upset-race-democratic-friendly-uresti-sea/,PATRICK SVITEK,Republican Pete Flores upsets Democrat Pete Gallego in race for Uresti seat,"SEPT. 18, 2018",2018-09-18
https://www.texastribune.org/2018/09/17/texas-gop-determined-flip-democratic-friendly-state-senate-seat/,PATRICK SVITEK,GOP determined to flip Democratic-friendly state Senate seat in overtime round,"SEPT. 17, 2018",2018-09-17
https://www.texastribune.org/2018/09/18/ted-cruz-leads-beto-orourke-54-45-quinnipiac-poll-says/,PATRICK SVITEK,"Ted Cruz leads Beto O'Rourke 54 to 45, new poll says","SEPT. 18, 2018",2018-09-18
https://www.texastribune.org/2018/10/01/barack-obama-endorses-texas-candidates/,PATRICK SVITEK,Obama endorses 9 more Texas candidates in midterm races,"OCT. 1, 2018",2018-10-01
https://www.texastribune.org/2018/09/19/how-pete-flores-upset-democrat-win-texas-state-senate-seat/,PATRICK SVITEK,How Texas Democrats lost a state Senate seat amid talk of a blue wave,"SEPT. 19, 2018",2018-09-19
https://www.texastribune.org/2018/09/22/beto-orourke-ted-cruz-first-senate-debate-full-video/,ALANA ROCHA,Watch Ted Cruz and Beto O'Rourke in first Senate debate,"SEPT. 22, 2018",2018-09-22
https://www.texastribune.org/2018/09/28/greg-abbott-lupe-valdez-debate-watch/,PATRICK SVITEK,"Gov. Greg Abbott and challenger Lupe Valdez spar over arming teachers, Harvey recovery in debate","SEPT. 28, 2018",2018-09-28
https://www.texastribune.org/2018/09/19/beto-orourke-leads-cruz-new-poll-texas-senate-race/,KATHRYN LUNDSTROM,"Beto O’Rourke leads Ted Cruz by 2 among likely voters in U.S. Senate race, new poll finds","SEPT. 19, 2018",2018-09-19
https://www.texastribune.org/2018/09/21/ted-cruz-beto-orourke-debate-watch-texas-senate/,PATRICK SVITEK,"Ted Cruz and Beto O'Rourke clash over immigration, Trump, guns during intense debate","SEPT. 21, 2018",2018-09-21
https://www.texastribune.org/2018/09/19/analysis-neal-dikeman-voter-ted-cruz-beto-orourke-senate-texas/,ROSS RAMSEY,Analysis: Neal Dikeman’s voters could decide which Texan serves in the U.S. Senate,"SEPT. 19, 2018",2018-09-19
https://www.texastribune.org/2018/09/27/analysis-texas-senator-schwertner-bad-news-trickle-down/,ROSS RAMSEY,"Analysis: For state Sen. Charles Schwertner, bad news and a trickle-down effect","SEPT. 27, 2018",2018-09-27
https://www.texastribune.org/2018/09/26/will-hurd-gina-ortiz-jones-trump-record-cd-23/,PATRICK SVITEK,"In age of Trump, Republican U.S. Rep. Will Hurd's independence again on the ballot in 23rd District","SEPT. 26, 2018",2018-09-26
https://www.texastribune.org/2018/09/24/analysis-texas-republican-singing-blues/,ROSS RAMSEY,Analysis: A few Texas Republicans are singing the blues,"SEPT. 24, 2018",2018-09-24
https://www.texastribune.org/2018/09/27/beto-cruz-virtual-debate/,ALANA ROCHA,We set up a virtual debate between Beto O'Rourke and Ted Cruz. Hear where they stand.,"SEPT. 27, 2018",2018-09-27
https://www.texastribune.org/2018/09/20/miller-olson-split-decision/,ALANA ROCHA,"Trade wars, ""Meatless Mondays"" and BBQ. Texas Agriculture Commissioner candidates square off","SEPT. 20, 2018",2018-09-20
https://www.texastribune.org/2018/09/20/donald-trump-texas-republicans-endorsing-democrats/,CASSANDRA POLLOCK,"Some Texas Republicans are endorsing Democrats. Is it ""Texas over party"" or sour grapes?","SEPT. 20, 2018",2018-09-20
https://www.texastribune.org/2018/09/21/analysis-dan-patrick-reddest-texas-senate-ever/,ROSS RAMSEY,Analysis: Dan Patrick and the reddest Texas Senate ever,"SEPT. 21, 2018",2018-09-21
https://www.texastribune.org/2018/09/26/sexual-misconduct-allegation-jolts-sen-charles-schwertners-district/,MATT ZDUN,Sexual misconduct allegation jolts Texas Sen. Charles Schwertner's district,"SEPT. 26, 2018",2018-09-26
https://www.texastribune.org/2018/09/22/texas-ted-cruz-beto-orourke-debate-claims/,EMMA PLATOFF,"""Modern-day Jim Crow."" ""We're going to protect pre-existing conditions."" Here’s a closer look at claims made at Ted Cruz and Beto O'Rourke's debate.","SEPT. 22, 2018",2018-09-22
https://www.texastribune.org/2018/09/30/beto-orourke-nixed-debate-ad-facebook-live-ted-cruz/,PATRICK SVITEK,Beto O'Rourke uses nixed debate time slot to shoot ad on Facebook Live,"SEPT. 30, 2018",2018-09-30
https://www.texastribune.org/2018/09/19/ted-cruz-center-us-supreme-court-storm-after-kavanaugh-allegations/,ABBY LIVINGSTON,Ted Cruz at center of U.S. Supreme Court storm,"SEPT. 19, 2018",2018-09-19
https://www.texastribune.org/2018/09/27/texas-tribune-festival-live/,TEXAS TRIBUNE STAFF,Watch livestreams of the 2018 Texas Tribune Festival's featured events,"SEPT. 27, 2018",2018-09-27
https://www.texastribune.org/2018/09/27/ted-cruz-beto-orourke-fundraising-out-of-texas/,ALEX SAMUELS,How much money have Ted Cruz and Beto O'Rourke raised outside Texas? We don't know for sure.,"SEPT. 27, 2018",2018-09-27
https://www.texastribune.org/2018/09/20/mike-collier/,OMAR RODRIGUEZ-ORTIZ,Democratic lieutenant governor hopeful Mike Collier talks school funding and property taxes,"SEPT. 20, 2018",2018-09-20
https://www.texastribune.org/2018/10/01/greg-abbott-releases-tv-ad-featuring-family-survived-sutherland-spring/,PATRICK SVITEK,Abbott releases TV ad featuring family that survived Sutherland Springs shooting,"OCT. 1, 2018",2018-10-01
https://www.texastribune.org/2018/09/29/texas-tribune-festival-beto-orourke/,ABBY LIVINGSTON,"U.S. Rep. Beto O'Rourke discusses DWI, term limits","SEPT. 29, 2018",2018-09-29
https://www.texastribune.org/2018/09/29/nancy-pelosi-democrats-should-focus-healthcare-working-families/,EDGAR WALTERS,"Nancy Pelosi: Democrats should focus on health care, working families — not abolishing ICE","SEPT. 29, 2018",2018-09-29
https://www.texastribune.org/2018/09/27/texas-tribune-festival-john-kerry/,EMMA PLATOFF,John Kerry hails 2018 midterms as “greatest course-correction moment we’ve had in years”,"SEPT. 27, 2018",2018-09-27
https://www.texastribune.org/2018/09/24/sen-ted-cruz-texas-heckled-restaurant-over-kavanaugh-controversy/,ABBY LIVINGSTON,Ted Cruz heckled in Washington restaurant over Kavanaugh controversy,"SEPT. 24, 2018",2018-09-24
https://www.texastribune.org/2018/09/28/brett-kavanaugh-FBI-investigation-delay-vote/,MATTHEW WATKINS,Cornyn: Senate SCOTUS vote to be delayed while FBI investigates Kavanaugh,"SEPT. 28, 2018",2018-09-28
https://www.texastribune.org/2018/10/01/tribcast-live-texas-tribune-festival/,EMILY RAMSHAW,TribCast: Live from the Texas Tribune Festival,"OCT. 1, 2018",2018-10-01
https://www.texastribune.org/2018/09/28/texas-tribune-festival-michael-avenatti/,KATHRYN LUNDSTROM,"Michael Avenatti talks Brett Kavanaugh, 2020 run","SEPT. 28, 2018",2018-09-28
https://www.texastribune.org/2018/09/21/3d-printed-gun-designer-cody-wilson-reportedly-arrested-taiwan/,MATTHEW WATKINS,3D-printed gun designer Cody Wilson arrested in Taiwan,"SEPT. 21, 2018",2018-09-21
https://www.texastribune.org/2018/09/19/3d-printed-gun-designer-cody-wilson-charged-sexual-assault/,MATT ZDUN,3D-printed gun designer Cody Wilson is wanted on charge of sexually assaulting an underage girl,"SEPT. 19, 2018",2018-09-19
https://www.texastribune.org/2018/09/18/gentrification-threatens-austins-low-income-residents-and-communities-/,BRANDON FORMBY,"Report says gentrification threatens to displace Austin's low-income residents, communities of color","SEPT. 18, 2018",2018-09-18
https://www.texastribune.org/2018/09/20/george-p-bush-school-land-board-state-board-education/,TEO ARMUS,Land Commissioner George P. Bush fighting with a Texas education board over allocations to fund schools,"SEPT. 20, 2018",2018-09-20
https://www.texastribune.org/2018/09/25/cody-wilson-sexual-assault-defense-distributed-3D-gun/,EMMA PLATOFF,"After sexual assault charges, Cody Wilson resigns from 3D-printed gun company","SEPT. 25, 2018",2018-09-25
https://www.texastribune.org/2018/09/21/texas-attorney-general-church-austin-school/,EMMA PLATOFF,Texas Attorney General warns Austin ISD: Don’t stop churches from renting school facilities,"SEPT. 21, 2018",2018-09-21
https://www.texastribune.org/2018/09/22/trump-immigration-public-assistance-visas/,THE WASHINGTON POST,Trump administration seeks to limit access to U.S. for immigrants who use or are likely to use public assistance,"SEPT. 22, 2018",2018-09-22
https://www.texastribune.org/2018/09/17/beto-orourke-joins-chorus-calling-firing-officer-who-shot-botham-jean/,JOLIE MCCULLOUGH,"After the death of Botham Jean, should a Dallas officer be fired? Those decisions often take time.","SEPT. 17, 2018",2018-09-17
https://www.texastribune.org/2018/09/18/texas-prison-guard-charged-inmate-death/,JOLIE MCCULLOUGH,A Texas prison guard has been charged in an assault connected to an inmate's death,"SEPT. 18, 2018",2018-09-18
https://www.texastribune.org/2018/09/21/border-wall-texas-mexico-trump-el-paso/,JULIÁN AGUILAR,"Federal officials unveil plans for four-mile, 18-foot-tall wall on Texas-Mexico border","SEPT. 21, 2018",2018-09-21
https://www.texastribune.org/2018/09/28/texas-tribune-festival-bill-de-blasio-new-york-city-mayor/,TEO ARMUS,"Mayor Bill de Blasio says his ""progressive vision"" for New York City can be copied across the country","SEPT. 28, 2018",2018-09-28
https://www.texastribune.org/2018/09/25/anti-nuclear-waste-tour-kicks-houston/,MATT ZDUN,Anti-nuclear waste tour kicks off in Houston,"SEPT. 25, 2018",2018-09-25
https://www.texastribune.org/2018/09/29/klobuchar-kavanaugh-supreme-court-2020-jeff-flake/,EMMA PLATOFF,"Sen. Amy Klobuchar says Brett Kavanaugh is ""not the person for the Supreme Court""","SEPT. 29, 2018",2018-09-29
https://www.texastribune.org/2018/09/21/teacher-retirement-system-leaves-retired-teacher-health-premiums-uncha/,MATT ZDUN,Texas’ Teacher Retirement System will not raise health premiums for retired teachers,"SEPT. 21, 2018",2018-09-21
https://www.texastribune.org/2018/09/29/sanchez-part-owner-property-leased-southwest-key-programs-eller-said-a/,SHANNON NAJMABADI,Southwest Key CEO has financial stake in property leased by migrant shelter operator,"SEPT. 29, 2018",2018-09-29
https://www.texastribune.org/2018/09/25/university-texas-sexual-misconduct-allegation-charles-schwertner/,SHANNON NAJMABADI,Report: UT investigating sexual misconduct allegation levied against state Sen. Charles Schwertner,"SEPT. 25, 2018",2018-09-25
https://www.texastribune.org/2018/10/01/border-asylum-port-of-entry-texas-mexico/,HANNAH WILEY,Critics say new barriers on border bridge are meant to deter asylum-seekers,"OCT. 1, 2018",2018-10-01
https://www.texastribune.org/2018/09/24/amber-guyger-fired-dallas-police-after-shooting-botham-jean/,JOLIE MCCULLOUGH,Amber Guyger fired from Dallas Police Department after shooting of Botham Jean,"SEPT. 24, 2018",2018-09-24
https://www.texastribune.org/2018/10/01/southwest-key-hires-child-welfare-organization-review-processes/,SHANNON NAJMABADI,Southwest Key hires child welfare organization to review processes,"OCT. 1, 2018",2018-10-01
https://www.texastribune.org/2018/09/17/border-patrol-agent-had-arsenal-attempted-suicide-cop-officials-say/,JULIÁN AGUILAR,"Border Patrol agent had arsenal in home, attempted ""suicide by cop,"" officials say","SEPT. 17, 2018",2018-09-17
https://www.texastribune.org/2018/10/01/texas-special-education-fifth-circuit/,ALIYYA SWABY,Texas spent less on students with disabilities. But did it break the law?,"OCT. 1, 2018",2018-10-01
https://www.texastribune.org/2018/09/25/ken-paxton-texas-law-student-stand-pledge-allegiance-/,EMMA PLATOFF,Attorney General Ken Paxton defends Texas law requiring students to stand for Pledge of Allegiance,"SEPT. 25, 2018",2018-09-25
https://www.texastribune.org/2018/09/20/dallas-bail-sytem-judge-order/,JOLIE MCCULLOUGH,Federal judge rules against Dallas County bail practices,"SEPT. 20, 2018",2018-09-20
https://www.texastribune.org/2018/09/27/John-Cornyn-Ted-Cruz-Brett-Kavanaugh/,ANDREW EVERSDEN,"U.S. Sen. John Cornyn calls Kavanaugh hearing ""embarrassing,"" draws McCarthy comparisons","SEPT. 27, 2018",2018-09-27
https://www.texastribune.org/2018/09/19/Texas-solicitor-general-kyle-hawkins-scott-keller-ken-paxton/,EMMA PLATOFF,"As solicitor general, Kyle Hawkins will lead Texas fights against the federal government","SEPT. 19, 2018",2018-09-19
https://www.texastribune.org/2018/10/03/analysis-crossing-border-texas-election-cruz-orourke/,ROSS RAMSEY,"Analysis: Crossing the (other) Texas borders, as elections near","OCT. 3, 2018",2018-10-03
https://www.texastribune.org/2018/10/16/Prairie-View-voter-registration/,MATT ZDUN,"Prairie View A&M University's voter registration issues are resolved, but voting barriers remain","OCT. 16, 2018",2018-10-16
https://www.texastribune.org/2018/10/15/donald-trump-campaign-ted-cruz-houston-texas-oct-22/,PATRICK SVITEK,Donald Trump to campaign for Ted Cruz in Houston on Oct. 22,"OCT. 15, 2018",2018-10-15
https://www.texastribune.org/2018/10/12/beto-orourke-raised-more-38-million-race-against-ted-cruz/,PATRICK SVITEK,Beto O’Rourke raised more than $38 million in the third quarter — a record that's about three times Ted Cruz’s haul,"OCT. 12, 2018",2018-10-12
https://www.texastribune.org/2018/10/02/mike-pence-campaign-ted-cruz-pete-sessions-dallas/,PATRICK SVITEK,"Mike Pence to campaign for Ted Cruz, Pete Sessions in Dallas","OCT. 2, 2018",2018-10-02
https://www.texastribune.org/2018/10/04/ted-cruz-says-he-raised-12m-third-quarter/,PATRICK SVITEK,Ted Cruz says he raised $12M in third quarter,"OCT. 4, 2018",2018-10-04
